{
  "schemaVersion": "1.0.0",
  "catalogRevision": "1.28c9c83c2336c0051e214111db8268d4",
  "endpoint": "/api/v1/arkham/campaign-catalog",
  "digestAlgorithm": "sha256",
  "campaigns": [
    {
      "id": "01",
      "difficultyLevels": {
        "Easy": [
          "PlusOne",
          "PlusOne",
          "Zero",
          "Zero",
          "Zero",
          "MinusOne",
          "MinusOne",
          "MinusOne",
          "MinusTwo",
          "MinusTwo",
          "Skull",
          "Skull",
          "Cultist",
          "Tablet",
          "AutoFail",
          "ElderSign"
        ],
        "Standard": [
          "PlusOne",
          "Zero",
          "Zero",
          "MinusOne",
          "MinusOne",
          "MinusOne",
          "MinusTwo",
          "MinusTwo",
          "MinusThree",
          "MinusFour",
          "Skull",
          "Skull",
          "Cultist",
          "Tablet",
          "AutoFail",
          "ElderSign"
        ],
        "Hard": [
          "Zero",
          "Zero",
          "Zero",
          "MinusOne",
          "MinusOne",
          "MinusTwo",
          "MinusTwo",
          "MinusThree",
          "MinusThree",
          "MinusFour",
          "MinusFive",
          "Skull",
          "Skull",
          "Cultist",
          "Tablet",
          "AutoFail",
          "ElderSign"
        ],
        "Expert": [
          "Zero",
          "MinusOne",
          "MinusOne",
          "MinusTwo",
          "MinusTwo",
          "MinusThree",
          "MinusThree",
          "MinusFour",
          "MinusFour",
          "MinusFive",
          "MinusSix",
          "MinusEight",
          "Skull",
          "Skull",
          "Cultist",
          "Tablet",
          "AutoFail",
          "ElderSign"
        ]
      },
      "returnTo": {
        "id": "50",
        "nameKey": "catalogNames.campaigns.01.returnTo.name"
      },
      "nameKey": "catalogNames.campaigns.01.name"
    },
    {
      "id": "02",
      "recommendedOptions": [
        {
          "type": "toggle",
          "option": {
            "tag": "PlayersDoNotControlStoryAssetClues"
          }
        }
      ],
      "difficultyLevels": {
        "Easy": [
          "PlusOne",
          "PlusOne",
          "Zero",
          "Zero",
          "Zero",
          "MinusOne",
          "MinusOne",
          "MinusOne",
          "MinusTwo",
          "MinusTwo",
          "Skull",
          "Skull",
          "Cultist",
          "AutoFail",
          "ElderSign"
        ],
        "Standard": [
          "PlusOne",
          "Zero",
          "Zero",
          "MinusOne",
          "MinusOne",
          "MinusOne",
          "MinusTwo",
          "MinusTwo",
          "MinusThree",
          "MinusFour",
          "Skull",
          "Skull",
          "Cultist",
          "AutoFail",
          "ElderSign"
        ],
        "Hard": [
          "Zero",
          "Zero",
          "Zero",
          "MinusOne",
          "MinusOne",
          "MinusTwo",
          "MinusTwo",
          "MinusThree",
          "MinusThree",
          "MinusFour",
          "MinusFive",
          "Skull",
          "Skull",
          "Cultist",
          "AutoFail",
          "ElderSign"
        ],
        "Expert": [
          "Zero",
          "MinusOne",
          "MinusOne",
          "MinusTwo",
          "MinusTwo",
          "MinusThree",
          "MinusThree",
          "MinusFour",
          "MinusFour",
          "MinusFive",
          "MinusSix",
          "MinusEight",
          "Skull",
          "Skull",
          "Cultist",
          "AutoFail",
          "ElderSign"
        ]
      },
      "returnTo": {
        "id": "51",
        "nameKey": "catalogNames.campaigns.02.returnTo.name"
      },
      "settings": [
        {
          "key": "Extracurricular Activity",
          "scenarioId": "02041",
          "settings": [
            {
              "type": "ChooseKey",
              "key": "ProfessorRice",
              "content": [
                {
                  "key": "ProfessorWarrenRiceWasKidnapped"
                },
                {
                  "key": "TheInvestigatorsRescuedProfessorWarrenRice"
                }
              ]
            },
            {
              "type": "Option",
              "key": "TakeWarrenRice",
              "ckey": "TakeWarrenRice",
              "ifRecorded": [
                {
                  "type": "key",
                  "key": "TheInvestigatorsRescuedProfessorWarrenRice"
                }
              ]
            },
            {
              "type": "SetKey",
              "key": "InvestigatorsWereUnconsciousForSeveralHours",
              "ckey": "InvestigatorsWereUnconsciousForSeveralHours",
              "ifRecorded": [
                {
                  "type": "key",
                  "key": "ProfessorWarrenRiceWasKidnapped"
                }
              ]
            },
            {
              "type": "ChooseKey",
              "key": "SchoolResolution",
              "content": [
                {
                  "key": "TheInvestigatorsFailedToSaveTheStudents",
                  "forceWhen": {
                    "type": "or",
                    "content": [
                      {
                        "type": "key",
                        "key": "TheInvestigatorsRescuedProfessorWarrenRice"
                      },
                      {
                        "type": "key",
                        "key": "InvestigatorsWereUnconsciousForSeveralHours",
                        "scope": "Extracurricular Activity"
                      }
                    ]
                  }
                },
                {
                  "key": "TheStudentsWereRescued"
                },
                {
                  "key": "TheExperimentWasDefeated"
                }
              ]
            }
          ]
        },
        {
          "key": "The House Always Wins",
          "scenarioId": "02062",
          "force": {
            "scenarioId": "02041"
          },
          "settings": [
            {
              "type": "ChooseKey",
              "key": "ProfessorMorgan",
              "content": [
                {
                  "key": "DrFrancisMorganWasKidnapped"
                },
                {
                  "key": "TheInvestigatorsRescuedDrFrancisMorgan"
                }
              ]
            },
            {
              "type": "Option",
              "key": "TakeFrancisMorgan",
              "ckey": "TakeFrancisMorgan",
              "ifRecorded": [
                {
                  "type": "key",
                  "key": "TheInvestigatorsRescuedDrFrancisMorgan"
                }
              ]
            },
            {
              "type": "ChooseKey",
              "key": "SchoolResolution",
              "content": [
                {
                  "key": "OBannionGangHasABoneToPickWithTheInvestigators",
                  "forceWhen": {
                    "type": "key",
                    "key": "TheInvestigatorsRescuedDrFrancisMorgan"
                  }
                },
                {
                  "key": "NaomiHasTheInvestigatorsBacks"
                }
              ]
            },
            {
              "type": "SetKey",
              "key": "InvestigatorsWereUnconsciousForSeveralHours",
              "ckey": "InvestigatorsWereUnconsciousForSeveralHours",
              "ifRecorded": [
                {
                  "type": "nor",
                  "content": [
                    {
                      "type": "key",
                      "key": "NaomiHasTheInvestigatorsBacks"
                    },
                    {
                      "type": "key",
                      "key": "TheInvestigatorsRescuedDrFrancisMorgan"
                    }
                  ]
                }
              ]
            },
            {
              "type": "Option",
              "key": "Cheated",
              "ckey": "Cheated"
            }
          ]
        },
        {
          "key": "Interlude I: Armitage's Fate",
          "settings": [
            {
              "type": "ForceKey",
              "key": "DrHenryArmitageWasKidnapped",
              "ifRecorded": [
                {
                  "type": "key",
                  "key": "InvestigatorsWereUnconsciousForSeveralHours"
                }
              ]
            },
            {
              "type": "ForceKey",
              "key": "TheInvestigatorsRescuedDrHenryArmitage",
              "ifRecorded": [
                {
                  "type": "not",
                  "content": {
                    "type": "key",
                    "key": "InvestigatorsWereUnconsciousForSeveralHours"
                  }
                }
              ]
            },
            {
              "type": "Option",
              "key": "TakeArmitage",
              "ckey": "TakeArmitage",
              "ifRecorded": [
                {
                  "type": "key",
                  "key": "TheInvestigatorsRescuedDrHenryArmitage"
                }
              ]
            }
          ]
        },
        {
          "key": "The Miskatonic Museum",
          "scenarioId": "02118",
          "settings": [
            {
              "type": "ChooseKey",
              "key": "NecronomiconStatus",
              "content": [
                {
                  "key": "TheInvestigatorsFailedToRecoverTheNecronomicon"
                },
                {
                  "key": "TheInvestigatorsDestroyedTheNecronomicon"
                },
                {
                  "key": "TheInvestigatorsTookCustodyOfTheNecronomicon"
                }
              ]
            },
            {
              "type": "Option",
              "key": "TakeTheNecronomicon",
              "ckey": "TakeTheNecronomicon",
              "ifRecorded": [
                {
                  "type": "key",